{
  "type": "uk.nhs.notify.example.order.read.v1",
  "source": "/nhs/england/notify/staging/primary/data-plane/example",
  "subject": "customer/ddb2cb8d-adef-90c4-4ded-dec62b967aa6/order/faf95df8-afcd-fdb1-cb3d-b6fac932c6a7/item/61df4efa-d0c0-f6b1-95d5-b488e349bebb",
  "dataschema": "file://../data/nhs-notify-example-event-data.schema.json",
  "specversion": "1.0",
  "id": "4efa5fcc-2494-401b-8cb2-e9f9a00ed6f3",
  "time": "2025-10-29T17:00:05.279Z",
  "datacontenttype": "application/json",
  "traceparent": "00-6229df8a2a518f79e2b32ac13c10d7ea-db2c1e2703ebce8c-01",
  "tracestate": "in sunt ex aliqua",
  "partitionkey": "customer-ddb2cb8d",
  "recordedtime": "2025-10-29T17:00:06.279Z",
  "sampledrate": 1,
  "sequence": "00000000000334123822",
  "severitytext": "DEBUG",
  "severitynumber": 1,
  "dataclassification": "public",
  "dataregulation": "PCI-DSS",
  "datacategory": "sensitive",
  "data": {
    "weather": {
      "id": "http://qxLIuoVZusTKezRnqDgKV.snnte4Qw1JR",
      "dateCreated": "1946-01-15T07:51:02.0Z",
      "dateModified": "1950-08-19T16:35:45.0Z",
      "source": "Ut ex sed reprehenderit",
      "name": "dolore sunt do",
      "alternateName": "voluptate",
      "description": "Excepteur minim proident cillum quis",
      "dataProvider": "Ut nostrud consectetur nisi do",
      "owner": [
        "$pJuc$",
        "d{K"
      ],
      "seeAlso": "https://LxGvRxQuEkNQfQBYlrWdJMEfNtCj.tcJULSg-EbiEYAoHynkUAmXf4FpgnAD3D4pnNmFc",
      "location": {
        "type": "MultiLineString",
        "coordinates": [],
        "bbox": [
          -55580392.97978576,
          -21244830.163521037,
          -93646661.54546277,
          -20680760.46098113
        ]
      },
      "address": {
        "streetAddress": "irure aliquip dolore",
        "addressLocality": "adipisicing",
        "addressRegion": "non mollit Duis cupidatat",
        "addressCountry": "proident",
        "postalCode": "qui",
        "postOfficeBoxNumber": "sed do officia exercitation irure",
        "streetNr": "mollit deserunt exercitation in",
        "district": "aute eu commodo ut Duis"
      },
      "areaServed": "aute ad nostrud proident",
      "weatherType": "dolor ut",
      "visibility": "good",
      "windDirection": 23.265893199255014,
      "windSpeed": 44453522.58687225,
      "gustSpeed": -64028827.911041364,
      "refPointOfInterest": "ut",
      "atmosphericPressure": 2553061.893219777,
      "illuminance": 16008124.516564215,
      "temperature": -97222586.16376893,
      "feelsLikeTemperature": -43452444.385692224,
      "relativeHumidity": 0.5168380512054745,
      "type": "WeatherForecast",
      "dateRetrieved": "1923-10-19T21:04:40.0Z",
      "dateIssued": "1925-09-17T19:57:02.0Z",
      "validity": "cillum",
      "validFrom": "1898-12-12T06:29:19.0Z",
      "validTo": "1948-05-23T18:17:08.0Z",
      "dayMaximum": {
        "temperature": -41129047.61740232,
        "feelLikesTemperature": 55826265.85908806,
        "relativeHumidity": 0.5034041464981399
      },
      "dayMinimum": {
        "temperature": 8835688.479716986,
        "feelLikesTemperature": -81382544.58637546,
        "relativeHumidity": 0.9014020535865983
      },
      "uVIndexMax": 18825981.074663367,
      "precipitation": 6682846.318338098,
      "precipitationProbability": 2727309.4949122
    },
    "nhsNumber": "9434765919"
  }
}