{
  "type": "uk.nhs.notify.supplier.allocation.file.printed.v1",
  "source": "/nhs/england/notify/staging/secondary/data-plane/supplierallocation",
  "dataschema": "file://../data/file-data.schema.json",
  "specversion": "1.0",
  "id": "9b7b5809-5aea-431d-af33-d0e9a9a414b6",
  "subject": "customer/dc9e382a-ef91-f361-b6a3-2b919e4d1fba/e/a8/4ks/l7l-/a7/dn3jyv0dt/feb6eaa0-aadd-0ffb-a93c-3b2bd3ba76bf/7c1f1406-2f2f-aebe-68af-1efcadfc59ef",
  "time": "2025-10-29T17:14:36.677Z",
  "datacontenttype": "application/json",
  "traceparent": "00-83f2572236ade907bbaff8cb0fdef3dc-a5a7c0146d4aea56-01",
  "tracestate": "velit deserunt mollit",
  "partitionkey": "customer-dc9e382a",
  "recordedtime": "2025-10-29T17:14:37.677Z",
  "sampledrate": 1,
  "sequence": "00000000000345902010",
  "severitytext": "INFO",
  "severitynumber": 2,
  "dataclassification": "confidential",
  "dataregulation": "HIPAA",
  "datacategory": "sensitive",
  "data": {
    "something": "anim Ut sunt"
  }
}