{
  "type": "uk.nhs.notify.supplier.allocation.file.received.v1",
  "source": "/nhs/england/notify/development/dev-1/data-plane/supplierallocation",
  "dataschema": "../data/file-data.schema.json",
  "data": {
    "something": "eu mollit Duis consequat aute"
  },
  "specversion": "1.0",
  "id": "5b12d76e-bc75-4897-9c23-4112ca23474f",
  "subject": "customer/f5b5cacc-54c8-03d5-eee5-b1013fdd5a36/0n/a4fc9a90-ffd2-a3b4-950e-78ceef997ba3/f/uliz3/9eb0cbaf-ce35-d323-8dfe-d64cb6bcc8b4/011acdaf-acb0-b746-e3ee-6efcc6595b1a/p81n4korh/43c5a5d0-4382-ebf9-28b3-c8ed9b22c004",
  "time": "2025-10-28T16:21:22.089Z",
  "datacontenttype": "application/json",
  "traceparent": "00-435456f2ec6842fcd8636bbd24675482-96cb847ba1f9ab5c-01",
  "tracestate": "in laboris quis irure consectetur",
  "partitionkey": "customer-f5b5cacc",
  "recordedtime": "2025-10-28T16:21:23.089Z",
  "sampledrate": 1,
  "sequence": "00000000000511107687",
  "severitytext": "DEBUG",
  "severitynumber": 1,
  "dataclassification": "restricted",
  "dataregulation": "ISO-27001",
  "datacategory": "standard"
}