{
  "type": "uk.nhs.notify.supplier.allocation.file.received.v1",
  "source": "/nhs/england/notify/development/primary/data-plane/supplierallocation",
  "dataschema": "file://../data/file-data.schema.json",
  "specversion": "1.0",
  "id": "3d3d0504-407b-4da9-a29c-81e58d291887",
  "subject": "customer/faf4bced-6a26-cfe5-6f38-2b8fafffe6aa/jkpd-/76h5foesa56/ae7e7eba-b8b1-1c1a-0aba-a697eb3efde9/0d72e886-cbeb-aac4-e4d4-aa9ceacd99b0/5afeed2f-d489-b6ff-7a1f-7bd6c4c8f96c/ab30dcae-e9d7-f85b-d048-6b2c8f4bcbc9/32a8af0f-13ed-7178-21e0-6c1abdefd6e1/3kp6qytg",
  "time": "2025-10-29T16:25:34.012Z",
  "datacontenttype": "application/json",
  "traceparent": "00-16399cef37659819544a1b50e09e69a1-2b96aa956bd664d6-01",
  "tracestate": "voluptate nulla qui amet aliquip",
  "partitionkey": "customer-faf4bced",
  "recordedtime": "2025-10-29T16:25:35.012Z",
  "sampledrate": 1,
  "sequence": "00000000000558009895",
  "severitytext": "WARN",
  "severitynumber": 3,
  "dataclassification": "restricted",
  "dataregulation": "NIST-800-53",
  "datacategory": "sensitive",
  "data": {
    "something": "sunt in"
  }
}